Album,Album ID,Release Date,Track Number,Disc Number,Track Name,Track ID,Explicit,Duration,Primary Artist,Featured Artists,Total Artists,Popularity,Genius Track ID,Lyrics,Word Count
ye,2Ek1q2haOnxVqhvVKqMvJe,2018-06-01,3,1,All Mine,3U21A07gAloCc4P7J8rxcn,True,145506,Kanye West,,1,68,3720959,"[Chorus: Ant Clemons]
Yeah, you supermodel thick
Damn, that ass bustin' out the bottom
I'ma lose my mind in it
Crazy, that medulla oblongata
Get to rubbin' on my lamp
Get the genie out the bottle

[Bridge: Ty Dolla $ign & Ant Clemons]
Fuck it up, fuck it up
Pussy good, go and back it up
Pipe her up, I'ma pipe her up
Make her mine, I done fell in love
Juicy thing, make that pussy sing
One more time, baby, do it big
Make it cry, come boo-hoo this shit

[Chorus: Ant Clemons]
Yeah, you supermodel thick
Damn, that ass bustin' out the bottom
I'ma lose my mind in it
Crazy, that medulla oblongata
Get to rubbin' on my lamp
Get the genie out the bottle

[Verse 1: Kanye West]
If I pull up with a Kerry Washington
That's gon' be an enormous scandal
I could have Naomi Campbell
And still might want me a Stormy Daniels
Sometimes, you gotta bag the boss up
I call that takin' Corey Gambles
Find yourself up in the food court
You might have to enjoy a sample
All these thots on Christian Mingle
Almost what got Tristan single
If you don't ball like him or Kobe
Guarantee that bitch gonna leave you
Ayy, time is extremely valuable
And I prefer to waste it on girls that's basic
That's just some Ye shit
Right now, let's do what we want
Let's have a threesome: me, you, and a blunt
I love your titties 'cause they prove
I can focus on two things at once

[Chorus: Ant Clemons]
Yeah, you supermodel thick
Damn, that ass bustin' out the bottom
I'ma lose my mind in it
Crazy, that medulla oblongata
Get to rubbin' on my lamp
Get the genie out the bottle
Get the genie out the bottle

[Verse 2: Kanye West]
Let me hit it raw like fuck the outcome
Ayy, none of us'd be here without cum
Ayy, if it ain't all about the income
Ayy, ayy, let me see you go ahead and spend some
Ayy, if you drivin' 'round in some Dri-Fit
Ayy, I'ma think that you the type to dry snitch
Hm, mhm, if I see you pull up with the three stripes
Ayy, ayy, I'ma fuck around and make you my bitch

[Chorus: Ant Clemons]
Yeah, you supermodel thick
Damn, that ass bustin' out the bottom
I'ma lose my mind in it
Crazy, that medulla oblongata
Get to rubbin' on my lamp
Get the genie out the bottle
Get the genie out the bottle",425
Late Registration,5ll74bqtkcXlKE7wwkMq4g,2005-08-30,9,1,Roses,2DHNCWZYmVr1Lv08q5b0kB,True,245866,Kanye West,,1,67,2029,"[Verse 1: Kanye West]
I know it's past visitin' hours
But can I please give her these flowers?
The doctor don't wanna take procedures
He claim her heart can't take the anesthesia
It'll send her body into a seizure
That lil' thing by the hospital bed, it'll stop beepin'
Hey, chick, I'm at a loss for words
What do you say at this time? Remember when I was nine?
Tell her everything gon' be fine, but I be lyin'
Her family cryin', they want her to live, and she tryin'
I'm arguin', like, ""What kind of doctor can we fly in?""
You know the best medicine go to people that's paid
If Magic Johnson got a cure for AIDS
And all the broke motherfuckers passed away
You tellin' me if my grandma's in the NBA
Right now, she'd be okay?
But since she was just a secretary
Working for the church for 35 years
Things 'sposed to stop right here?
My grandfather tryin' to pull it together, he strong
That's where I get my confidence from
I asked the nurse, ""Did you do the research?""
She asked me, ""Can you sign some t-shirts?""
""Bitch, is you smokin' reefer?
You don't see that we hurt?"" But still

[Chorus: Bill Withers & Tony Williams]
I smile
When roses come to see me
And I can't wait for a sunny day
Seeing it through your eyes
Can't wait for the clouds to break

[Verse 2: Kanye West]
They outside of the emergency room, room
You can feel my heartbeat, beat, beat
If she gon' pull through, we gon' find out soon
But right now, she 'sleep, sleep, sleep
My momma say they say she could pass away any day
Hey, chick, what these doctors know anyway?
Let me see the X-rays, I ain't no expert, I'm just hurt
Cousin Kim took off of work
Plus, my Aunt Shirley, Aunt Beverly, Aunt Klaye and Aunt Jean
So many aunties we could have an Auntie Team
Feel like Amerie, it's this ""1 Thing""
When they said that she made it, you see they eyes gleam
I think we at an all-time high
To get there, we run, we fly, we drive
'Cause with my family, we know where home is
So instead of sending flowers, we the roses

[Chorus: Bill Withers & Tony Williams]
I smile
When roses come to see me
And I can't wait for a sunny day
Seeing it through your eyes
Can't wait for the clouds to break

[Post-Chorus: Bill Withers & 
Patti LaBelle
]
'Cause Rosie brings the sunshine (
Oh
)

[Chorus: Bill Withers, Tony Williams, Patti LaBelle]
I smile (
Oh-oh-ah
)
When roses come to see me (Come to-come away)
And I can't wait for a sunny day (
I can't wait
)
Seeing it through your eyes
Can't wait for the clouds to break (
Your eyes, for the clouds to break, oh
)

[Post-Chorus: Bill Withers & Patti LaBelle]
I smile
When Rosie comes to see me
And I'm sad when Rosie goes away
'Cause Rosie brings the sunshine (
Say
)
[Outro: Patti LaBelle]
Can't wait, I can't wait, no
Can't wait, I can't wait, no
Can't wait, I can't wait
No, can't wait for
For a sunny day
Say ""Momma can't wait
For the clouds to break""
Mm, mm, mm, mm-mm, mm-mm
Oh-oh-oh-oh, no, no, say (Woah, say)
Tellin' you the truth now
Said I can't wait, uh-uh
I won't wait, oh no",580
The College Dropout,4Uv86qWpGTxf7fU7lG5X6F,2004-02-10,6,1,Spaceship,1ko2NuvWlQdxtNRc8QQzmT,True,324226,Kanye West,"GLC, Consequence",3,66,522,"[Produced by Kanye West]

[Chorus: Kanye West & 
GLC
]
I've been working this grave-shift
And I ain't made shit (Yeah, yeah)
I wish I could (
Me, too
)
Buy me a spaceship and fly (
I swear I do
)
Past the sky, oh
GLC feel you, Ye—I feel you, man
I've been working this grave-shift
And I ain't made shit
I wish I could
Buy me a spaceship and fly
Past the sky (Man, man, man...)
Oh, oh, oh

[Verse 1: Kanye West]
If my manager insults me again
I will be assaulting him
After I fuck the manager up
Then, I'm gonna shorten the register up
Let's go back, back to the Gap
Look at my check—wasn't no scratch
So if I stole, wasn't my fault
Yeah, I stole—never got caught
They take me to the back and pat me
Asking me about some khakis
But let some Black people walk in
I bet you they show off their token blackie
Oh, now they love Kanye
""Let's put him all in the front of the store""
So I'm on break
Next to the ""No Smoking"" sign with a blunt in the mall
Taking my hits, writing my hits
Writing my rhymes, playing my mind
This fucking job can't help him
So I quit, y'all welcome
Y'all don't know my struggle
Y'all can't match my hustle
You can't catch my hustle
You can't fathom my love, dude
Lock yourself in a room
Doing five beats a day for three summers
That's 
A Different World
 like Cree Summer's
I deserve to do these numbers
""The kid that made that deserves that Maybach!""
So many records in my basement
I'm just waitin' on my spaceship, blaow!

[Chorus: Kanye West, 
GLC
, & 
Kanye w/ Choir
]
I've been working this grave-shift
And I ain't made shit
I wish I could buy me a spaceship and fly
Past the sky, oh
I've been working this grave-shift
And I ain't made shit
I wish I could 
buy me a spaceship and fly
Past the sky
Tryna tell you, man, way past the sky
Oh, oh
 (
Let's go, ugh
)

[Verse 2: GLC]
And I didn't even try to work a job
Represent the mob at the same time (Woo)
Thirsty on the grind, Chi state of mind
Lost my mama, lost my mind (Aww)
Life, my love, that's not mine
""Why you ain't signed?"" Wasn't my time
Leave me alone, work for y'all
Half of it's yours, half of it's mine
Only wanna ball, never wanna fall (Ugh)
Gotta get mine, gotta take mine (Ugh)
Got a Tec-9, reach my prime (Ugh)
Gotta make these haters respect mine (Yeah)
In the mall 'til 12 when my schedule had said 9
Putting them pants on shelves
Waiting patiently, I ask myself
Where I wanna go, where I wanna be
Life is much more than running in the streets
Holler at 'Ye, hit me with the beat
Put me on my feet, sounds so sweet
Yes, I'm the same ol' G
Same goatee, stayin' low-key, nope
Holler at God: ""Man, why'd You have to take my folks?""
Hope to see Freddie G., Yusef G, love my G
Rolly G, police watch me
Smoke my weed and count my Gs
Got a lot of people counting on me (That's right)
And I'm just tryin' to find my peace (That's right)
Should've finished school like my niece
Then I finally wouldn't use my piece, blaow!

[Chorus: Kanye West, 
GLC
, & 
Kanye w/ Choir
]
I've been working this grave-shift
Aww, man, this pressure
And I ain't made shit
I wish I could
Buy me a spaceship and fly
Past the sky
, oh
I've been working this grave-shift
And I ain't made shit
I wish I could
Buy me a spaceship and fly
Past the sky
Oh, oh, oh

[Verse 3: Consequence]
I 'member having to take the dollar cab
Coming home real late at night
Standing on my feet all damn day
Tryna make this thing right
And havin' one of my coworkers say, ""Yo, you look just like
This kid I seen in an old Busta Rhymes video the other night""
Well, easy come, easy go, how that saying goes
No more broad service, cars, and them TV shows
That all had got snatched from me, A&Rs and they faculties
All turn they back on me and didn't wanna hear a rap from me
So naturally, actually, had to face things factually
Had to be a catastrophe, empty fridge is staring back at me
'Cause nothing's there, nothing's fair
I don't wanna ever go back there
So I won't be taking no days off 'til my spaceship takes off, blaow!

[Chorus: Kanye West & 
Kanye w/ Choir
]
I've been working this grave-shift
And I ain't made shit
I wish I could
Buy me a spaceship and fly
Past the sky
, oh
I've been working this grave-shift
And I ain't made shit
I wish I could
Buy me a spaceship and fly
Past the sky
Oh, oh, oh

[Outro: Tony Williams]
I wanna fly
I wanna fly
I said I want my chariot to pick me up
And take a brother for a ride
(Heaven knows, heaven knows)",878
The College Dropout,4Uv86qWpGTxf7fU7lG5X6F,2004-02-10,2,1,We Don't Care,0IW0qaeyxL5Et4UG2MrJKB,True,239880,Kanye West,,1,66,370,"[Intro]
Oh, yeah
I got the perfect song for the kids to sing
And all my people that's—

[Chorus]
Drug dealin' just to get by
Stack your money 'til it get sky high
We wasn't s'posed to make it past twenty-five
Joke's on you, we still alive
Throw your hands up in the sky and say
""We don't care what people say"" (Yeah, yeah, yeah, uh)

[Verse 1]
If this is your first time hearin' this
You are about to experience somethin' so cold, man
We never had nothin' handed, took nothin' for granted
Took nothin' from no man, man, I'm my own man
But as a shorty, I looked up to the dope man
Only adult man I knew that wasn't broke, man
Flicking Starter coats, man—man, you don't know, man
We don't care what people say
This is for my niggas outside all winter
'Cause this summer, they ain't finna say, ""Next summer, I'm finna...""
Sittin' in the hood like community colleges
This dope money here is Lil' Trey's scholarship
'Cause ain't no tuition for having no ambition
And ain't no loans for sittin' your ass at home
So we forced to sell crack, rap, and get a job
You gotta do somethin', man, your ass is grown

[Chorus: Kanye West with Choir]
Drug dealin' just to get by
Stack your money 'til it get sky high
Kids, sing! Kids, sing!
We wasn't s'posed to make it past twenty-five
Joke's on you, we still aliveThrow your hands up in the sky and say
""We don't care what people say""

[Verse 2]
This second verse is for my dogs working nine to five that still hustle
'Cause a nigga can't shine off $6.55
And everybody sellin' makeup, Jacob's
And bootleg tapes just to get they cake up
We put shit on layaway, then come back
We claim other people kids on our income tax
We take that money, cop work, then push packs to get paid
And we don't care what people say
Mama say she wanna move South
Scratching lottery tickets, eyes on a new house
'Round the same time, Doe ran up in dude house
Couldn't get a job, so since he couldn't get work, he figured he'd take work
The drug game bulimic, it's hard to get weight
So niggas' money is homo, it's hard to get straight
But we gon' keep bakin' 'til the day we get cake
And we don't care what people say
My niggas—

[Chorus: Kanye West & Choir, Kanye West]
Drug dealin' just to get by (
Yeah
)
Stack your money 'til it get sky high
Kids, sing! Kids, sing!
We wasn't s'posed to make it past twenty-five
Joke's on you, we still alive (
Alive
)
Throw your hands up in the sky and say (
Uh-huh, yeah
)
""We don't care what people say"" (
Yeah, yeah, ugh
)

[Verse 3]
You know the kids gon' act a fool
When you stop the programs for after school
And they DCFS, some of 'em dyslexic
They favorite 50 Cent song ""12 Questions""
We scream: ""Rocks, blows, weed, park,"" see, now we smart
We ain't retards the way teachers thought
Hold up, hold fast, we make more cash
Now, tell my mama I belong in that slow class
It's bad enough we on welfare
You tryna put me on the school bus with the space for the wheelchair
I'm tryna get the car with the chromey wheels here
You tryna cut our lights out like we don't live here
Look what was handed us, fathers abandoned us
When we get them hammers, go on, call the ambulance
Sometimes, I feel no one in this world understands us
But we don't care what people say
My niggas—

[Chorus: Kanye West & Choir, Kanye West]
Drug dealin' just to get by
Stack your money 'til it get sky high
Kids, sing! Kids, sing!
We wasn't s'posed to make it past twenty-five
Joke's on you, we still alive
Throw your hands up in the sky and say
""We don't care what people say""

[Produced by Kanye West]",684
Late Registration,5ll74bqtkcXlKE7wwkMq4g,2005-08-30,2,1,Heard 'Em Say,6yIjtVtnOBeC8SwdVHzAuF,True,203733,Kanye West,Adam Levine,2,66,1329,"[Produced by Kanye West and Jon Brion]

[Intro]
West—Mr. West—Mr. West
Uh, yeah, uh, yeah
Uh, yeah, uh, yeah

[Verse 1: Kanye West]
And I heard 'em say
Nothing's ever promised tomorrow, today
From the Chi, like Tim, it's a harder way
So this is in the name of love like Robert say
Before you ask me to go get a job today
Can I at least get a raise on the minimum wage?
And I know the government administer AIDS
So I guess we just pray like the minister say
Allāhu Akbar and throw in some hot cars
The things we seen on the screen is not ours
But these niggas from the hood so these dreams not far
Where I'm from the dope boys is the rock stars
But they can't cop cars without seeing cop cars
I guess they want us all behind bars—I know it

[Chorus: Kanye West & 
Adam Levine
]
Uh, and I heard 'em say (
Ooh
)
Nothing's ever promised tomorrow, today
And I heard 'em say
Nothing's ever promised tomorrow, today
(
Nothing's ever promised tomorrow, today
)
But we'll a find a way
And nothing lasts forever, but be honest, babe
It hurts, but it may be the only way

[Verse 2: Kanye West]
They say people in your life are seasons
And anything that happen is for a reason
And niggas gun clapping and keep to squeezing
And Gran' keep praying and keep believing
In Jesus, and one day that you see him
'Til then walk in his footsteps and try to be him
The Devil is alive, I feel him breathin'
Claiming money is the key, so keep on dreamin'
And put them lottery tickets just to tease us
My Aunt Pam can't put them cigarettes down
So now my little cousin smokin' them cigarettes now
His job try to claim that he too niggarish now
Is it 'cause his skin blacker than licorice now?
I can't figure it out, I'm sick of it now

[Chorus: Kanye West & 
Adam Levine
]
Ugh, and I heard 'em say (
Ooh
)
Nothing's ever promised tomorrow, today
And I heard 'em say
Nothing's ever promised tomorrow, today (
Nothing's ever promised tomorrow, today
)
But we'll a find a way
And nothing last forever, but be honest, babe
It hurts, but it may be the only way

[Post-Chorus: Adam Levine]
With every worthless word, we get more far away
And nothing's ever promised tomorrow, today
And nothing lasts forever, but be honest, babe
It hurts but it may be the only way
Ooh, ooh, ooh-ooh
Ooh, oh, oh-oh
Oh, woo-woo
Oh, ooh, ooh

[Outro: Kanye West]
Uh, yea, uh, yea, uh, yea",453
Late Registration,5ll74bqtkcXlKE7wwkMq4g,2005-08-30,14,1,We Major,46fk9wjYcPm0sgym2b7EEE,True,448000,Kanye West,"Nas, Really Doe",3,65,2452,"[Produced by Jon Brion, Kanye West & Warryn Campbell]

[Chorus: Really Doe]
You motherfuckers better do your job and roll up and watch how we roll up, and
I can't control it, can't hold it, it's so nuts
I take a sip of that 'gnac, I wanna fuck
I take a hit of that chronic, it got me stuck
But really, what's amazing is how I keep blazing
Towel under the door, we smoke until the day's end
Puff-puff, then pass. Don't fuck up rotation
Hpnotiq for Henny? Now, nigga, that's a chaser
Turn nothing to something, now, pimping, that's a savior
Best things are green, now, pimpin', get your paper
High off the ground, from stair to skyscraper
Cool out thinking we local. C'mon, homie, we major

[Post-Chorus: Kanye West]
We major? C'mon, homie, we major
We major? C'mon, homie, we major
We major! C'mon, homie, we major
We major! C'mon

[Verse 1: Kanye West]
Feeling better than some head on a Sunday afternoon
Better than a chick that say ""Yes"" too soon
Until you have a daughter; that's what I call karma
And you pray to God she don't grow breasts too soon
Projects tore up, gang signs is thrown up
Niggas hats broke off, that's how we grow up
Why else you think shorties write rhymes? Just to blow up?
Get they first car and then, IRS show up
He ain't never had shit, but he had that nine
Nigga come through flicking and he had that shine
Put two and two together and a little bad weather
Gon' be your whole family on that funeral line
Asked the reverend, ""Was the strip clubs cool?
If my tips helped send a pretty girl through school?""
That's all I want, like winos want they good whiskey
I ain't in the Klan, but I brought my hood with me

[Chorus: Really Doe]
You motherfuckers better do your job and roll up and watch how we roll up, and
I can't control it, can't hold it, it's so nuts
I take a sip of that 'gnac, I wanna fuck
I take a hit of that chronic, it got me stuck
But really, what's amazing is how I keep blazing
Towel under the door, we smoke until the day's end
Puff puff, then pass. Don't fuck up rotation
Hpnotiq for Henny? Now, nigga, that's a chaser
Turn nothing to something, now, pimping, that's a savior
Best things are green, now, pimpin', get your paper
High off the ground, from stair to skyscraper
Cool out, thinking we local, c'mon, homie, we major

[Post-Chorus: Nas]
We major? C'mon, homie, we major
We major? C'mon, homie, we major
We major! C'mon, homie, we major
We major! C'mon, homie, we major

[Verse 2: Nas]
I heard the beat and I ain't know what to write
First line—should it be about the hoes or the ice?
Four-fours or Black Christ? Both flows'd be nice
Rap about big paper or the black man plight
At the studio console, asked my man to the right
""What this verse sound like? Should I freestyle or write?
He said, ""Nas, what the fans want is Illmatic, still"" (Illmatic, still)
Looked at the pad and pencil, and jotted what I feel
Been like twelve years since a nigga first signed
Now, I'm a free agent, and I'm thinking it's time
To build my very own Motown
'Cause rappers be deprived of executive nine-to-fives
And it hurts to see these companies be stealing the life
And I love to give my blood, sweat and tears to the mic
So y'all copped the LPs and y'all fiends got dealt
I'm Jesse Jackson on the balcony when King got killed
I survived the livest niggas around
Lasted longer than more than half of you clowns
Look, I used to cook before I had the game took
Either way, my change came like Sam Cooke

[Refrain: Tony Williams & Nas]
Bah-dah-bah-bah (Yeah, yeah, yeah-yeah, yeah-yeah)
Feeling better than I ever felt before today
Like better late than never; it's orientation
Still, we can make it better, throwing all your cares away (Oh, oh, oh, ooh!)

[Chorus: Really Doe & 
Tony Williams
]
You motherfuckers better do your job and roll up and watch how we roll up, and (Bah-dah-bah-bah)
I can't control it, I can't hold it, it's so nuts
I take a sip of that 'gnac, I wanna fuck
I take a hit of that chronic, it got me stuck
But really what's amazing is how I keep blazing
Towel under the door, we smoke until the day's end
Puff-puff, then pass. Don't fuck up rotation
Hpnotiq for Henny? Now, nigga, that's a chaser (Oh, oh, oh, ooh!)
Turn nothing to something, now, pimping, that's a savior (Bah-dah-bah-bah)
Best things are green, now, pimpin', get your paper
High off the ground, from stair to skyscraper
Cool out, thinking we local, c'mon, homie, we major

[Post-Chorus: Kanye West & Nas]
We major? (
C'mon, homie, we major
)
We major? (
C'mon, homie, we major
)
We major! (
C'mon, homie, we major
)
We major!

[Refrain: Tony Williams]
Oh, oh, oh, ooh! Bah-dah-bah-bah
Feeling better than I ever felt before today
But better late than never; it's orientation
Still, we can make it better, throwing all your cares away!

[Interlude: Kanye West & Tony Williams]
Can I talk my shit again? (Can I talk my shit again?)
Can I talk my shit again? (Can I talk my shit again?)
I can't believe I'm back up in this motherfucker (I can't believe I'm back up in this motherfucker)
I'mma be late, though (I'mma be late, though. I'mma be late, though)
I gotta figure out what I'm finna wear (I gotta figure out what I'm finna wear)
Yeah (Yeah, yeah)
The Roc is definitely in the building (Building, building)
G.O.O.D. Music's definitely in the building. Ugh (Building, building)
I gotta say ""What's up"" to Tony Williams (I gotta say ""What's up"" to Tony Williams, Tony Williams)
On the vocals! (On the vocals!)
Sings—He sings quite beautifully, don't you agree? (Don't you agree? Don't you agree?)
Don't you agree? (Don't you agree? Don't you agree?)
Ugh (Ugh)
And Jon Brion on the keys right now (And Jon Brion on the keys right now)
And Warryn Campbell on the keys right now (And Warryn Campbell on the keys right now)
So they asked me: (So they asked me, so they asked me)
""Why you call it 
Late Registration
, 'Ye?"" (Why you call it 
Late Registration
, 'Ye?)
'Cause we takin' these motherfuckers back to school ('Cause we takin' these motherfuckers back to school)
La, la, la, la-la-la-la la
If you know this part right here (If you know this part right here)
Feel free to sing along (Feel free to sing along, sing along)
La la la la la, la-la-la

[Refrain: Tony Williams & Kanye West]
Bah-dah-bah-bah (Oh)
Feeling better than I ever felt before today (If you feeling good)
But better late than never; it's orientation (
It's orientation
)
But we can make it better, throwing all your cares away

[Outro: Tony Williams & Kanye West]
We want you 
to get used to this
Oh, oh, oh, ooh! Bah-dah-bah-bah
Ugh! They can't do what we do, baby
Uh-uh, uh-uh! They can't do what we do, baby
Uh-uh, uh-uh! They can't do what we do, baby
Yeah
Oh, oh, oh, ooh!",1235
Yeezus,7D2NdGvBHIavgLhmcwhluK,2013-06-18,5,1,Hold My Liquor,5nIu0VwPOsjkF61zfevLKh,True,326946,Kanye West,,1,65,171397,"[Produced by Arca, Kanye West, Mike Dean, and Noah Goldstein]

[Intro: Justin Vernon]
I can't hold my liquor
But this man can't handle his weed
Dark and lonely now
On Chicago, south of town
I'm onto Indiana
I heard it in the radio now

[Refrain: Chief Keef]
I can't handle no liquor
But these bitches can't handle me
I can't control my niggas
And my niggas, they can't control me
You say you know me, my nigga
But you really just know the old me

[Verse: Kanye West]
Bitch, I'm back out my coma
Wakin' up on your sofa
When I parked my Range Rover
Slightly scratched your Corolla
Okay, I smashed your Corolla
I'm hangin' on a hangover
Five years, we been over
Ask me why I came over
One more hit and I can own you
One more fuck and I can own you
One cold night in October
Pussy had me floatin', feel like Deepak Chopra
Pussy had me dead, might call 2Pac over
Yeezy's all on your sofa
These the Red Octobers
Still ain't learn me no manners
You love me when I ain't sober
You love me when I'm hungover
Even when I blow doja
Then her auntie came over
Skinny bitch with no shoulders
Tellin' you that I'm bogus
Bitch, you don't even know us
""Baby girl, he's a loner
Baby girl, he's a loner""
Late-night organ donor
After that, he disown you
After that, he's just hopeless
Soulmates become soulless
""When it's over, it's over""
And bitch, I'm back out my coma

[Chorus: Justin Vernon & 
Kanye West
]
Callin' up your uncle's place (
I'm not enough, enough
)
Shit's all over the place (
Enough, enough, oh-oh-oh
)
I don't hear your phone
Oh, I'ma phone home

[Refrain: Chief Keef]
I can't handle no liquor
But these bitches can't handle me
I can't control my niggas
And my niggas, they can't control me
You say you know me, my nigga
But you really just know the old me

[Bridge: Justin Vernon & Kanye West]
I heard you need a new fad (
A new girl, a new girl
)
I heard you need a new stack (
A new girl, a new girl
)
I heard you need a new phone (
A new girl, a new girl
)
I know your 'rents ain't be home (
A new girl, a new girl
)

[Chorus: Justin Vernon & Kanye West]
Callin' up your uncle's place (
A new girl, a new girl
)
Shit's all over the place (
A new girl, a new girl
)
I don't hear your phone
Oh, I'ma phone home

[Instrumental Outro]",446
