Album,Album ID,Release Date,Track Number,Disc Number,Track Name,Track ID,Explicit,Duration,Primary Artist,Featured Artists,Total Artists,Popularity,Genius Track ID,Lyrics,Word Count
Late Registration,5ll74bqtkcXlKE7wwkMq4g,2005-08-30,3,1,Touch The Sky,2dxjKgT0li4qBI3QwuN9Ih,True,236600,Kanye West,Lupe Fiasco,2,78,681,"[Chorus: Kanye West]
I gotta testify
Come up in the spot lookin' extra fly
'Fore the day I die, I'ma touch the sky
Gotta testify
Come up in the spot lookin' extra fly
'Fore the day I die, I'ma touch the sky

[Verse 1: Kanye West]
Back when they thought pink Polos would hurt the Roc
Before Cam got the shit to pop
The doors was closed
I felt like Bad Boy's street team: I couldn't work the locks
Now let's go, take 'em back to the plan
Me and my momma hopped in that U-Haul van
Any pessimists, I ain't talk to them
Plus I ain't have no phone in my apart-a-ment
Let's take 'em back to the club
Least about an hour I stand on line
I just wanted to dance, I went to Jacob an hour
After I got my advance, I just wanted to shine
Jay favorite line: ""Dawg, in due time!""
Now he look at me, like, ""Damn, dawg! You where I am!""
A hip-hop legend
I think I died in that accident, ‘cause this must be Heaven

[Chorus: Kanye West]
I gotta testify
Come up in the spot lookin' extra fly
'Fore the day I die, I'ma touch the sky
Gotta testify
Come up in the spot lookin' extra fly
'Fore the day I die, I'ma touch the sky

[Post-Chorus: Kanye West]
Now let's take them hi-ah-igh-igh-igh-ighhhh
(Top of the world, baby, top, top of the world!)
A-la-la-la-lah-la-lahhhhh
(Top of the world, baby, on top of the world!)
Now let's take them hi-ah-igh-igh-igh-ighhhh
(Top of the world, baby, top, top of the world!)
A-la-la-la-lah-la-lahhhhh
(Top of the world, baby, on top of the world!)

[Verse 2: Kanye West]
Back when Gucci was the shit to rock
Back when Slick Rick got the shit to pop
I'd do anything to say I got it
Damn, them new loafers hurt my pocket
Before anybody wanted K. West beats
Me and my girl split the buffet at KFC
Dawg, I was havin' nervous breakdowns
Like ""Man, these niggas that much better than me?""
Baby, I'm goin' on an aeroplane
And I don't know if I'll be back again
Sure enough, I sent the plane tickets
But when she came to kick it, things became different
Any girl I cheated on, sheets I skeeted on
Couldn't keep it at home, thought I needed a Nia Long
I'm tryin' to right my wrongs
But it's funny them same wrongs helped me write this song, now

[Chorus: Kanye West]
I gotta testify
Come up in the spot lookin' extra fly
'Fore the day you die, you gon' touch the sky
You gon' touch the sky, baby girl, testify
Come up in the spot lookin' extra fly
'Fore the day you die, you gon' touch the sky

[Verse 3: Lupe Fiasco]
Yes, yes, yes, guess who's on third?
Lupe steal like Lupin the 3rd
Here like ear 'til I'm beer on the curb
Peachfuzz buzz but beard on the verge
Let's slow it down like we're on the syrup
Bottle-shaped body like Mrs. Butterworth
But before you say another word
I'm back on the block like I'm layin' on the street
I'm tryna stop lyin' like I'm Mumm-Ra
But I'm not lyin' when I'm layin' on the beat, en garde
Or touché, Lupe cool as the unthawed
But I still feel possessed as a gun charge
Come as correct as a porn star
In a fresh pair steps in my best foreign car
So, I represent the first
Now let me end my verse right where the horns are, like uh

[Chorus: Kanye West]
I gotta testify
Come up in the spot lookin' extra fly
'Fore the day you die, you gon' touch the sky
You gon' touch the sky, baby girl, testify
Come up in the spot lookin' extra fly
'Fore the day you die, you gon' touch the sky

[Outro: Kanye West]
We back at home, baby!
Sky high, I’m, I’m sky high!
I’m, I’m sky high!
I’m, I’m sky high!
I’m, I’m sky high!
I’m, I’m sky high!
Sky, sky high! I’m, I’m sky high!
Yeah, keep it rollin'!
Yeah, uh, feels good to be home, baby!
Feels good to be home!

[Produced by Just Blaze]",708
JESUS IS KING,0FgZKfoU2Br5sHOfvZKTI9,2019-10-25,8,1,God Is,6xRWoYwfwIKnT8bQGzKbxR,False,203141,Kanye West,,1,76,4824662,"[Intro]
God is
My light in darkness, oh
God, God is
He, He is my all and all (And I'll never turn back)
God is

[Verse]
Everything that hath breath praise the Lord
Worship Christ with the best of your portions
I know I won't forget all He's done
He's the strength in this race that I run
Every time I look up, I see God's faithfulness
And it shows just how much He is miraculous
I can't keep it to myself, I can't sit here and be still
Everybody, I will tell 'til the whole world is healed
King of Kings, Lord of Lords, all the things He has in store
From the rich to the poor, all are welcome through the door
You won't ever be the same when you call on Jesus' name
Listen to the words I'm sayin', Jesus saved me, now I'm sane
And I know, I know God is the force that picked me up
I know Christ is the fountain that filled my cup
I know God is alive, yeah
He has opened up my vision
Giving me a revelation
This ain't 'bout a dead religion
Jesus brought a revolution
All the captives are forgiven
Time to break down all the prisons
Every man, every woman
There is freedom from addiction
Jesus, You have my soul
Sunday Service on a roll
All my idols, let 'em go
All the demons, let 'em know
This a mission, not a show
This is my eternal soul
This my kids, this the crib
This my wife, this my life
This my God-given right
Thank You, Jesus, won the fight

[Outro]
That's what God is
That's what God is
That's what God is",286
Watch The Throne,0OcMap99vLEeGkBCfCwRwS,2011-08-08,1,1,No Church In The Wild,7r6PigmGzlB3YPB7wvBBbi,True,272506,JAY-Z,"Kanye West, Frank Ocean, The-Dream",4,76,52020,"[Produced By 88 Keys, Kanye West & Mike Dean]

[Chorus: Frank Ocean]
Human beings in a mob
What's a mob to a king?
What's a king to a god?
What's a god to a non-believer
Who don't believe in anything?
Will he make it out alive?
Alright, alright
No church in the wild

[Verse 1: JAY-Z]
Tears on the mausoleum floor
Blood stains the Colosseum doors
Lies on the lips of a priest
Thanksgiving disguised as a feast
Rolling in the Rolls-Royce Corniche
Only the doctors got this, I'm hiding from police
Cocaine seats
All white like I got the whole thing bleached
Drug dealer chic
I'm wondering if a thug's prayers reach
Is Pius pious 'cause God loves pious?
Socrates asked whose bias do y'all seek?
All for Plato, screech
I'm out here balling, I know y'all hear my sneaks
Jesus was a carpenter, Yeezy laid beats
Hova flow the Holy Ghost, get the hell up out your seats
Preach

[Chorus: Frank Ocean]
Human beings in a mob
What's a mob to a king?
What's a king to a god?
What's a god to a non-believer
Who don't believe in anything?
Will he make it out alive?
Alright, alright
No church in the wild

[Bridge: The-Dream]
I live by you, desire
I stand by you, walk through the fire
Your love is my scripture
Let me in through your encryption
Yeah, yeah

[Verse 2: Kanye West]
Coke on her Black skin made it stripe like a zebra
I call that jungle fever
You will not control the threesome
Just roll the weed up until I get me some
We formed a new religion
No sins as long as there's permission
And deception is the only felony
So never fuck nobody without telling me
Sunglasses and Advil
Last night was mad real
Sun coming up, 5 a.m
.
I wonder if they got cabs still
Thinking 'bout the girl in all leopard
Who was rubbing the wood like Kiki Shepard
Two tattoos, one read, ""No apologies""
The other said, ""Love is cursed by monogamy""
That's something that the pastor don't preach
That's something that a teacher can't teach
When we die, the money, we can't keep
But we'll probably spend it all 'cause the pain ain't cheap
Preach

[Chorus: Frank Ocean]
Human beings in a mob
What's a mob to a king?
What's a king to a god?
What's a god to a non-believer
Who don't believe in anything?
Will he make it out alive?
Alright, alright
No church in the wild

[Outro: Frank Ocean]
No church in the wild
No church in the wild
No church in the wild",440
Graduation,4SZko61aMnmgvNhfhgTuD3,2007-09-11,5,1,Good Life,4ZPdLEztrlZqbJkgHNw54L,True,207000,Kanye West,T-Pain,2,75,1043,"[Produced by DJ Toomp, Kanye West, and Mike Dean]

[Chorus: Kanye West, 
T-Pain
 & 
Both
]
Like we always do at this time
I go for mine, I got to shine
(Now throw yo' hands up in the sky)
I g-go for mine, I got to shine
(Now throw yo' hands up in the sky)
I'ma get on this TV, mama, I'ma
I'ma put shit down
Ayy, 
ayy
, ayy, 
ayy
Ayy, 
ayy
, ayy, 
I'm good

[Verse 1: Kanye West & T-Pain]
Welcome to the good life, where niggas that sell D
Won't even get pulled over in they new V
The good life, let's go on a livin' spree
Shit, they say the best things in life are free
The good life, it feel like Atlanta
It feel like L.A., it feel like Miami
It feel like NY, summertime Chi', ah
(
Now throw yo' hands up in the sky
)
So I roll through good
Y'all pop the trunk, I pop the hood, Ferrari
And she got the goods
And she got that ass, I got to look, sorry
Yo, it's got to be 'cause I'm seasoned
Haters give me them salty looks, Lawry's
50 told me, ""Go 'head, switch the style up
And if they hate then let 'em hate and watch the money pile up""
The good life

[Chorus: Kanye West & T-Pain]
Now I, I go for mine, I got to shine
(Now throw yo' hands up in the sky)
Now I, I go for mine, I got to shine
(Now throw yo' hands up in the sky) Ayy
I'ma get on this TV, mama, I'ma
I'ma put shit down
Ayy, 
ayy
, ayy, 
ayy
Ayy, 
ayy
, ayy, 
I'm good

[Verse 2: Kanye West & T-Pain]
Welcome to the good life
Where we like the girls who ain't on TV
'Cause they got mo' 
ass than the models
The good life, so keep it comin' with the bottles
'Cause she feel booze like she bombed at Apollo
The good life, it feel like Houston
It feel like Philly, it feel like D.C.​
It feel like VA or the Bay or Yay
Ayy, this is the good life
(Welcome to the good life)
Homie, tell me what's good
Why I only got a problem when you in the hood
(Welcome to the good life)
Like I'm new in the hood
The only thing I wish, I wish a nigga would
(Welcome to the good life)
He probably think he could
But, but, I don't think he should
(Oh, welcome to the good li-li-li-life, oh)
50 told me, ""Go 'head, switch the style up
And if they hate then let 'em hate and watch the money pile up""
The good life

[Chorus: Kanye West & T-Pain]
Now I, I go for mine (Yeah), I got to shine
(Now throw yo' hands up in the sky)
Now I, I go for mine, I got to shine
(Now throw yo' hands up in the sky) Ayy
I'ma get on the TV, mama, I'ma
I'ma put shit down
Ayy, 
ayy
, ayy, 
ayy
Ayy, 
ayy
, ayy, 
I'm good

[Verse 3: Kanye West & T-Pain]
Yeah, yeah
Have you ever popped champagne on a plane, while gettin' some brain?
Whipped it out, she said, ""I never seen 
Snakes on a Plane
""
Whether you broke or rich, you gotta get this
Havin' money's not everythin', not havin' it is
I was splurgin' on trips
But when I get my card back activated, I'm back to Vegas
(Welcome to the good life)
'Cause I always had a passion for flashin'
Before I had it, I closed my eyes and imagined the good life

[Outro: T-Pain]
Ayy, it's the good life, better than the life I lived
When I thought that I was gonna go crazy
And now my grandmama
Ain't the only girl callin' me baby
If you feelin' me now, then put yo' hands up in the sky
And let me hear you say, ""Hey, hey"" (Hey, hey, hey)
(Ooh) I'm good!",674
Yeezus,7D2NdGvBHIavgLhmcwhluK,2013-06-18,1,1,On Sight,1gqkRc9WtOpnGIqxf2Hvzr,True,156480,Kanye West,,1,73,152626,"[Produced by Benji B, Daft Punk, Kanye West & Mike Dean]

[Verse 1: Kanye West]
Yeezy season approachin'
Fuck whatever y'all been hearin'
Fuck what, fuck whatever y'all been wearin'
A monster about to come alive again
Soon as I pull up and park the Benz
We get this bitch shaking like Parkinson's
Take my number and lock it in
Indian hair, no moccasins
It's too many hoes in this house of sin
Real nigga back in the house again
Black Timbs all on your couch again
Black dick all in your spouse again
And I know she like chocolate men
She got more niggas off than Cochran, hah!

[Refrain: Kanye West]
On sight
On sight

[Bridge: Kanye West]
How much do I not give a fuck?
Let me show you right now 'fore you give it up
How much do I not give a fuck?
Let me show you right now 'fore you give it up

[Interlude: Holy Name of Mary Choral Family]
Oh, He'll give us what we need
It may not be what we want

[Verse 2: Kanye West]
Baby girl tryna get a nut
And her girl tryna give it up
Chopped 'em both down
Don't judge 'em, Joe Brown
One last announcement
No sports bra, let's keep it bouncin'
Everybody wanna live at the top of the mountain
Took her to the 'Bleau, she tried to sip the fountain
That's when David Grutman kicked her out
But I got her back in and put my dick in her mouth

[Refrain: Kanye West]
On sight
On sight

[Bridge: Kanye West]
Uh-huh
Uh-huh
Uh-huh
Uh-huh

[Outro: Kanye West]
Right now
I need right now
Right now
I need, I need right now
Right now
I need, I need right now",293
Yeezus,7D2NdGvBHIavgLhmcwhluK,2013-06-18,2,1,Black Skinhead,722tgOgdIbNe3BEyLnejw4,True,188013,Kanye West,,1,71,152933,"[Produced By Daft Punk & Kanye West]

[Verse 1]
For my theme song (
Black
)
My leather black jeans on (
Black
)
My by-any-means on
Pardon, I'm getting my scream on (
Black
)
Enter the kingdom (
Black
)
But watch who you bring home
They see a black man with a white woman
At the top floor they gone come to kill King Kong
Middle America packed in (
Black
)
Came to see me in my black skin (
Black
)
Number one question they're askin'
Fuck every question you askin' (
Black
)
If I don't get ran out by Catholics (
Black
)
Here come some conservative Baptists
Claiming I'm overreactin'
Like them black kids in Chiraq, bitch

[Chorus]
Four in the mornin', and I'm zonin'
They say I'm possessed, it's an omen
I keep it 300, like the Romans
Three hundred bitches, where the Trojans?
Baby, we livin' in the moment
I've been a menace for the longest
But I ain't finished, I'm devoted
And you know it, and you know it

[Post-Chorus]
So follow me up 'cause this shit 'bout to go (Down)
I'm doing 500, I'm outta control (Now)
But there's nowhere to go (Now)
And there's no way to slow (Down)
If I knew what I knew in the past
I would've been blacked out on your ass

[Chorus]
Four in the mornin', and I'm zonin'
They say I'm possessed, it's an omen
I keep it 300, like the Romans
Three hundred bitches, where the Trojans?
Baby, we livin' in the moment
I've been a menace for the longest
But I ain't finished, I'm devoted
And you know it, and you know it

[Verse 2]
Stop all that coon shit (
Black
)
Early morning cartoon shit (
Black
)
This is that goon shit
Fuck up your whole afternoon shit
I'm aware I'm a wolf
Soon as the moon hit
I'm aware I'm a king
Back out the tomb, bitch (
Black
)
Black out the room, bitch (
Black
)
Stop all that coon shit (
Black
)
These niggas ain't doin' shit (
Black
)
Them niggas ain't doin' shit
Come on, homie, what happened?
You niggas ain't breathin', you gaspin'
These niggas ain't ready for action
Ready, ready for action-action

[Chorus]
Four in the mornin', and I'm zonin'
I think I'm possessed, it's an omen
I keep it 300 like the Romans
Three hundred bitches, where the Trojans?
Baby, we livin' in the moment
I've been a menace for the longest
But I ain't finished, I'm devoted
And you know it, and you know it

[Post-Chorus]
So follow me up 'cause this shit 'bout to go (Down)
I'm doing 500, I'm outta control (Now)
But there's nowhere to go (Now)
And there's no way to slow (Down)
If I knew what I knew in the past
I would've been blacked out on your ass

[Outro]
God, God, God, God
God, God, God, God
God, God, God",501
JESUS IS KING,0FgZKfoU2Br5sHOfvZKTI9,2019-10-25,3,1,Follow God,2QpGZOhTCHHiKmpSO9FW4h,False,104591,Kanye West,,1,71,4904476,"[Intro]
Father, I stretch
Stretch my hands to You

[Verse]
Lifelike, this is what your life like, try to live your life right
People really know you, push your buttons like typewrite
This is like a movie, but it's really very lifelike
Every single night, right, every single fight, right?
I was looking at the 'Gram and I don't even like likes
I was screamin' at my dad, he told me, ""It ain't Christ-like""
I was screamin' at the referee just like Mike
Lookin' for a bright light, Sigel, what your life like
Riding on a white bike, feeling like Excitebike (
Stretch my hands to You
)
Pressin' on the gas, supernova for a night light
Screamin' at my dad and he told me, ""It ain't Christ-like""
But nobody never tell you when you're being like Christ
Only ever seein' me only when they needin' me
Like if Tyler Perry made a movie for BET
Searchin' for a deity, now you wanna see it free
Now you wanna see if we, let's just see if three apiece
Tell me what your life like, turn it down, a bright light
Drivin' with my dad, and he told me, ""It ain't Christ-like"" (
Stretch my hands to You
)
I'm just tryna find, l've been lookin' for a new way
I'm just really tryin' not to really do the fool way
I don't have a cool way, bein' on my best, though
Block 'em on the text though, nothin' else next though
Not another word, letter, picture, or a decimal (
Father, I stretch
)
Wrestlin' with God, I don't really want to wrestle
Man, it's really lifelike, everything in my life (
Stretch my hands to You
)
Arguing with my dad, and he said, ""It ain't Christ-like""

[Outro]
Man
You know, it's like
Somebody only close who can get you, like, off your
I be on my
I woke up this morning, I said my prayers
I'm all doing good, I tried to talk to my dad (
Stretch my hands to You
)
Give him some advice, he starts spazzin' on me
I start spazzin' back, He said ""That ain't Christ-like""
I said, ""Ahhh""",366
Watch The Throne,0OcMap99vLEeGkBCfCwRwS,2011-08-08,4,1,Otis,14I61w6cyYUHiV2n28IYdP,True,178213,JAY-Z,"Kanye West, Otis Redding",3,70,52019,"[Produced by Kanye West]

[Intro: Otis Redding & 
JAY-Z
]
It makes it easier, easier to bear
You won't regret it, no, no, no
Some girls, they don't forget it
Love is their only happiness
Squee'— Squee'— Squee'—
(
Sounds so soulful, don't you agree?
)
Squeeze her, don't tease her, never leave her

[Verse 1: JAY-Z]
Uh, I invented swag
Poppin' bottles, puttin' supermodels in the cab
Proof
I guess I got my swagger back, truth
New watch alert, Hublots
Or the big-face Rollie, I got two of those
Arm out the window, through the city, I maneuver slow
Cock back, snapback, see my cut through the holes, Hov

[Verse 2: Kanye West]
Damn, Yeezy and Hov, where the hell you been?
Niggas talking real reckless, stuntmen
I adopted these niggas, Phillip Drummond them
Now I'm 'bout to make 'em tuck they whole summer in
They say I'm crazy, well, I'm 'bout to go dumb again
They ain't seen me 'cause I pulled up in my other Benz
Last week, I was in my other, other Benz
Throw your diamonds up 'cause we in this bitch another 'gain

[Verse 3: JAY-Z]
Photoshoot fresh, looking like wealth
I'm 'bout to call the paparazzi on myself
Uh, live from the Mercer
Run up on Yeezy the wrong way, I might murk ya
Flee in the G450, I might surface
Political refugee, asylum can be purchased
Uh, everything's for sale
I got five passports, I'm never going to jail

[Verse 4: Kanye West]
I made ""Jesus Walks,"" I'm never going to hell
Couture-level flow is never going on sale
Luxury rap, the Hermès of verses
Sophisticated ignorance, write my curses in cursive
I get it custom, you a customer
You ain't accustomed to going through customs, you ain't been nowhere, hah?
And all the ladies in the house got 'em showing off
I'm done, I'll hit you up maña— nah

[Verse 5: JAY-Z]
Welcome to Havana
Smoking Cubanos with Castro in cabanas
Viva México, Cubano
Dominicano, all the plugs that I know
Driving Benzes with no benefits
Not bad, huh, for some immigrants?
Build your fences, we diggin' tunnels
Can't you see we gettin' money up under you?

[Verse 6: Kanye West, Jay-Z & Both]
Can't you see the private jets flying over you?
Maybach bumper sticker read, ""What would Hova do?""
Jay is chillin' (
Uh
), Ye is chillin' (
Uh
)
What more can I say? We killin' 'em
Hold up before we end this campaign
As you can see, we done bodied the damn lames
Lord, please let them accept the things they can't change
And pray that all of they pain be champagne

[Outro]
Scream it
Give it
Scream it",453
Watch The Throne,0OcMap99vLEeGkBCfCwRwS,2011-08-08,12,1,Why I Love You,4bDPr2VAjcfgUDmN9dGOC3,True,201453,JAY-Z,"Kanye West, Mr Hudson",3,70,51901,"[Produced By Anthony Kilhoffer, Kanye West & Mike Dean]

[Chorus: Mr. Hudson]
Ooh, I love you so
But why I love you, I'll never know
Ooh, I love you so
But why I love you, I'll never know
Ooh, I love you so
But why I love you, I'll never know
Ooh, I love you so
But why I love you, I'll never know

[Verse 1: Jay-Z]
Picture, if you will, that the throne's burning
Rome's burning, and I'm sitting in the corner all alone, burning
Why does it always end up like this?
Something that we don't determine
Same people that I fought for, that I fight for, that I ride for
That I live for, that I die for
Be the reason that these niggas is alive for
And they want me dead, but I'm sorry, but I just can't die for you
But I can make 'em put their hands in the sky for you
We waiting for the fireworks like July 4th
Get fly more, get high more, cry boy, why for?
When the grief is over, beef is over
I'll be fly when Easter's over
I tried to teach niggas how to be kings
And all they ever wanted to be was soldiers
So when love is gone 'til blood is drawn
'Cause we no longer wear the same uniform
Fuck you, squares, the circle got smaller
The castle got bigger, the walls got taller
And truth be told, after all that said
Niggas still got love for you

[Chorus: Mr. Hudson]
Ooh, I love you so
But why I love you, I'll never know
Ooh, I love you so
But why I love you, I'll never know
Ooh, I love you so
But why I love you, I'll never know
Ooh, I love you so
But why I love you, I'll never know

[Verse 2: Jay-Z & Kanye West]
Showed love to you niggas
You ripped out my heart and you stepped on it
I picked up the pieces 'fore you swept on it
Goddamn, this shit leaves a mess, don't it?
Shit feelin' like death, don't it?
Charge it to the game, whatever's left on it
I spent about a minute, maybe less on it
Fly, pelican, fly, turn the jets on it
But first I shall digress on it
Wasn't I a good king?
Maybe too much of a good thing, huh?
Didn't I spoil you? Me or the money, what you loyal to?
Huh, I gave you my loyalty
Made you royalty and royalties
Took care of these niggas' lawyer fees
And this is how niggas rewarded me, damn

[Chorus: Mr. Hudson]
Ooh, I love you so
But why I love you, I'll never know
Ooh, I love you so
But why I love you, I'll never know

[Verse 3: Jay-Z & Kanye West]
Bussin' at me, b-b-b-bussin' at me
But I'm bulletproof, bitch, you can't get nothin' past me
Got body armor
A nigga gotta watch the throne
And I'm bussin' back
So niggas in a glass house should not throw stones
What do you do when the love turn to hate?
Gotta separate from these fuckin' fakes
Caesar didn't see it, so he ceased to exist
So the nigga that killed him had keys to his shit
Am I my brother's keeper?
Only if that nigga don't creep up
Got a pistol under my pillow
I've never been a deep sleeper
P-P-P-Paranoia, 
'cause the nigga that said he'll
Blast for ya 
is now
 blastin' for ya
That's an assassin for ya
These niggas got a shot, they'll shoot
Please Lord, 
forgive him
For these niggas 
not know
 what they do, ooh",612
