Album,Album ID,Release Date,Track Number,Disc Number,Track Name,Track ID,Explicit,Duration,Primary Artist,Featured Artists,Total Artists,Popularity,Genius Track ID,Lyrics,Word Count,peak_pos,wks_on_chart,Charted
ye,2Ek1q2haOnxVqhvVKqMvJe,2018-06-01,7,1,Violent Crimes,3s7MCdXyWmwjdcWh7GWXas,True,215320,Kanye West,,1,82,3756527,"[Intro: 070 Shake]
Fallin', dreamin', talkin' in your sleep
I know you want to cry all night, all night
Plottin', schemin', findin'
Reason to defend all of your violent nights
Promise me you will see

[Chorus: 070 Shake]
Don't you grow up in a hurry, your mom'll be worried, aw
It was all part of the story, even the scary nights
Thank you for all of the glory, you will be remembered, aw
Thank you to all of the heroes of the night (Night, night)
They gotta repaint the colors, the lie is wearin' off
Reality is upon us, colors drippin' off
Colors drippin' off

[Verse: Kanye West]
Niggas is savage, niggas is monsters
Niggas is pimps, niggas is players
'Til niggas have daughters, now they precautious
Father, forgive me, I'm scared of the karma
'Cause now I see women as somethin' to nurture
Not somethin' to conquer
I hope she like Nicki, I make her a monster
Not havin' ménages, I'm just bein' silly
I answered the door like Will Smith and Martin
Nigga, do we have a problem?
Matter fact, Marlon, this ain't 
Meet the Fockers
I'll beat his ass, pray I beat the charges
No, Daddy don't play, not when it come to they daughters
Don't do no yoga, don't do pilates
Just play piano and stick to karate
I pray your body's draped more like mine
And not like your mommy's
Just bein' salty, but niggas is nuts
And I am a nigga, I know what they want
I pray that you don't get it all at once
Curves under your dress, I know it's pervs all on the net
All in the comments, you wanna vomit
That's your baby, you love her to death
Now she cuttin' class and hangin' with friends
You break a glass and say it again
She can't comprehend the danger she in
If you whoop her ass, she move in with him
Then he whoop her ass, you go through it again
But how you the devil rebukin' the sin?
Let's pray we can put this behind us
I swear that these times is the wildest
She got the scars, they serve as reminders
Blood still on her pajamas
But yesterday is dead, yeah, moment of silence
Next, she'll be off to college and then at the altar
'Cause she know that niggas is savage, niggas is monsters
Niggas is pimps, niggas is players, 'til niggas have daughters
Niggas is pimps, niggas is players, 'til niggas have daughters

[Chorus: 070 Shake & Ty Dolla $ign]
Don't you grow up in a hurry, your mom'll be worried, aw
It was all part of the story, even the scary nights
Thank you for all of the glory, you will be remembered, aw
Thank you to all of the heroes of the night (Night, night)
They gotta repaint the colors, the lie is wearin' off
Reality is upon us, colors drippin' off
Colors drippin' off

[Outro: Nicki Minaj]
I'm saying it like...
""I want a daughter like Nicki, aw, man, I promise
I'ma turn her to a monster, but no ménages""
I don't know how you saying it, but let 'em hear this",530,27.0,2.0,True
Graduation,4SZko61aMnmgvNhfhgTuD3,2007-09-11,9,1,Flashing Lights,5TRPicyLGbAF2LGBFbHGvO,True,237506,Kanye West,Dwele,2,87,523,"[Intro: Connie Mitchell]
Flashing lights
Flashing lights
Flashing lights
Flashing lights

[Verse 1: Kanye West]
She don't believe in shootin' stars
But she believe in shoes and cars
Wood floors in the new apartment
Couture from the store's departments
You more like love to start shit
I'm more of the trips to Florida
Ordered the hors d'oeuvres, views of the water
Straight from a page of your favorite author
And the weather so breezy
Man, why can't life always be this easy?
She in the mirror dancin' so sleazy
I get a call like, ""Where are you, Yeezy?""
And try to hit you with the ol-wu-wopte
'Til I got flashed by the paparazzi
Damn, these niggas got me
I hate these niggas more than a Nazi

[Chorus: Dwele & 
Connie Mitchell
]
As I recall, I know you love to show off
But I never thought that you would take it this far
But what do I know?
Flashing lights
What do I know? Know
Flashing lights

[Verse 2: Kanye West]
I know it's been a while, sweetheart
We hardly talk, I was doin' my thing
I know I was foul, baby
A-bay, lately, you've been all on my brain
And if somebody would've told me a month ago
Frontin' though, yo, I wouldn't wanna know
If somebody would've told me a year ago
It'll go get this difficult
Feelin' like Katrina with no FEMA
Like Martin with no Gina
Like a flight with no visa
First class with the seat back, I still see ya
In my past, you on the other side of the glass
Of my memory's museum
I'm just sayin', ""Hey, Mona Lisa
Come home, you know you can't roam without Caesar""

[Chorus: Dwele & Connie Mitchell]
As I recall, I know you love to show off
But I never thought that you would take it this far
But what do I know?
Flashing lights
What do I know? Know
Flashing lights
As you recall, you know I love to show off
But you never thought that I would take it this far
But what do you know?
Flashing lights
What do you know? Know
Flashing lights

[Outro: Connie Mitchell]
Flashing lights
Flashing lights",368,29.0,20.0,True
The Life Of Pablo,7gsWAHLeT0w7es6FofOXk1,2016-06-10,4,1,Famous,19a3JfW8BQwqHWUMbcqSx8,True,196040,Kanye West,,1,70,2412662,"[Intro: Rihanna & Kanye West]
Man, I can understand how it might be
Kinda hard to love a girl like me
I don't blame you much for wanting to be free
I just wanted you to know
Woo, woo
Swizz told me let the beat rock
 (Oh)
Oh

[Verse 1: Kanye West & Swizz Beatz]
For all my Southside niggas that know me best
I feel like me and Taylor might still have sex
Why? I made that bitch famous (
Goddamn
)
I made that bitch famous
For all the girls that got dick from Kanye West
If you see 'em in the streets, give 'em Kanye's best
Why? They mad they ain't famous (
Goddamn
)
They mad they still nameless (
Talk that talk, man
)
Her man in the store tryna try his best
But he just can't seem to get Kanye fresh
But we still hood famous (
Goddamn
)
Yeah, we still hood famous

[Chorus: Rihanna & Swizz Beatz]
I just wanted you to know
I've loved you better than your own kin did
From the very start
I don't blame you much for wanting to be free
Wake up, Mr. West! Oh, he's up!
I just wanted you to know

[Verse 2: Kanye West & Swizz Beatz]
I be Puerto Rican day parade floatin'
That Benz Marina Del Rey coastin'
She in school to be a real estate agent
Last month, I helped her with the car payment
Young and we alive, 
whoo!
We never gonna die, 
whoo!
I just copped a jet to fly over personal debt
Put one up in the sky
The sun is in my eyes, 
whoo!
Woke up and felt the vibe, 
whoo!
No matter how hard they try, 
whoo!
We never gonna die

[Chorus: Rihanna & 
Swizz Beatz
]
I just wanted you to know
Get 'em!

[Bridge: Sister Nancy & Swizz Beatz]
Bam, 'ey 'ey 'ey
Bam bam, bam, bam bam dilla
Bam bam 'ey 'ey 'ey
What a bam, bam, bam bam dilla
How you feeling right now? Let me see your lighters in the air
Bam bam 'ey 'ey 'ey 'ey 'ey
Bam bam 'ey 'ey 'ey
What a bam
Let me see your middle finger in the air
Bam 'ey 'ey 'ey
Bam bam, bam, bam bam dilla
Let me see you act up in this motherfucker
Bam bam 'ey 'ey 'ey
What a bam, bam, bam bam dilla
How you feelin', how you feelin', how you feelin' in this mother fucker, God damn
Bam bam 'ey 'ey 'ey 'ey 'ey
Bam bam 'ey 'ey 'ey
What a bam
One thing you can't do 
is
 stop us now
Bam 'ey 'ey 'ey
Bam bam bam, bam bam dilla
Ayy, you can't stop the thing now
Bam bam 'ey 'ey 'ey
What a bam, bam, bam bam dilla
Man, it's way too late, it's way too late, it's way too late, you can't fuck with us
Bam bam, 'ey 'ey 'ey 'ey 'ey
Bam bam, 'ey 'ey 'ey
What a bam
To the left, to the right
Bam 'ey 'ey 'ey
Bam bam bam, bam bam dilla
I wanna see everybody hands in the air like this
Bam bam 'ey 'ey 'ey
What a bam, bam, bam bam dilla
Bam bam 'ey 'ey 'ey 'ey 'ey
Bam bam 'ey 'ey 'ey
What a bam, bam

[Outro: Nina Simone]
I just wanted you to know
I loved you better than your own kin did
From the very start
I don't blame you much for wanting to be free
I just wanted you to know

[Produced by Kanye West, Charlie Heat, Havoc & Noah Goldstein]",609,34.0,14.0,True
JESUS IS KING,0FgZKfoU2Br5sHOfvZKTI9,2019-10-25,8,1,God Is,6xRWoYwfwIKnT8bQGzKbxR,False,203141,Kanye West,,1,76,4824662,"[Intro]
God is
My light in darkness, oh
God, God is
He, He is my all and all (And I'll never turn back)
God is

[Verse]
Everything that hath breath praise the Lord
Worship Christ with the best of your portions
I know I won't forget all He's done
He's the strength in this race that I run
Every time I look up, I see God's faithfulness
And it shows just how much He is miraculous
I can't keep it to myself, I can't sit here and be still
Everybody, I will tell 'til the whole world is healed
King of Kings, Lord of Lords, all the things He has in store
From the rich to the poor, all are welcome through the door
You won't ever be the same when you call on Jesus' name
Listen to the words I'm sayin', Jesus saved me, now I'm sane
And I know, I know God is the force that picked me up
I know Christ is the fountain that filled my cup
I know God is alive, yeah
He has opened up my vision
Giving me a revelation
This ain't 'bout a dead religion
Jesus brought a revolution
All the captives are forgiven
Time to break down all the prisons
Every man, every woman
There is freedom from addiction
Jesus, You have my soul
Sunday Service on a roll
All my idols, let 'em go
All the demons, let 'em know
This a mission, not a show
This is my eternal soul
This my kids, this the crib
This my wife, this my life
This my God-given right
Thank You, Jesus, won the fight

[Outro]
That's what God is
That's what God is
That's what God is",286,36.0,1.0,True
The Life Of Pablo,7gsWAHLeT0w7es6FofOXk1,2016-06-10,2,1,Father Stretch My Hands Pt. 1,4KW1lqgSr8TKrvBII0Brf8,True,135920,Kanye West,,1,79,2412669,"[Intro: Pastor T.L. Barrett / Choir & 
Future
]
You're the only power (Power)
You're the only power that can
You're the only power (Power)
You're the only power that can
Oh, oh, oh, Father
(
If Young Metro don't trust you, I'm gon' shoot you
)

[Pre-Chorus: Kid Cudi & Pastor T.L. Barrett / Choir]
Beautiful mornin', you're the sun in my mornin', babe (
Who can I turn to?
)
Nothin' unwanted (
After all, who can I turn to?
)
Beautiful mornin', you're the sun in my mornin', babe (
If I don't turn to You
)
Nothin' unwanted (
No other help I know, I stretch my hands
)

[Chorus: Kanye West & Pastor T.L. Barrett / Choir]
I just wanna feel liberated, I-I, na-na-na (
Who can I turn to?
)
I just wanna feel liberated, I-I, na-na-na (
After all, who can I turn to?
)
If I ever instigated, I am sorry (
If I don't turn to You
)
Tell me who in here could relate, I-I-I (
No other help I know, I stretch my hands
)

[Verse: Kanye West & Kelly Price]
Now, if I fuck this model
And she just bleached her asshole
And I get bleach on my T-shirt
I'ma feel like an asshole
I was high when I met her
We was down in Tribeca
She'll get under your skin if you let her
She'll get under your skin if you— (Uh)
I don't even wanna talk about it, I don't even wanna talk about it
I don't even wanna say nothin'
Everybody gon' say somethin'
I'd be worried if they said nothin'
Remind me where I know you from
She lookin' like she owe you somethin'
You know just what we want, 
I wanna wake up with you in my—

[Pre-Chorus: Kid Cudi, Pastor T.L. Barrett / Choir & Kelly Price]
Beautiful mornin', you're the sun in my mornin', babe (
Who can I turn to?
)
Beautiful mornin'
Nothin' unwanted (
After all, who can I turn to?
)
Beautiful mornin', you're the sun in my mornin', babe (
If I don't turn to You
)
Nothin' unwanted (
No other help I know
)

[Chorus: Kanye West & Pastor T.L. Barrett / Choir]
I just wanna feel liberated, I-I, na-na-na (
Who can I turn to?
)
I just wanna feel liberated, I-I, na-na-na (
After all, who can I turn to?
)
If I ever instigated, I am sorry (
If I don't turn to You
)
Tell me who in here could relate, I-I-I (
No other help I know, I stretch my hands
)",443,37.0,23.0,True
Late Registration,5ll74bqtkcXlKE7wwkMq4g,2005-08-30,3,1,Touch The Sky,2dxjKgT0li4qBI3QwuN9Ih,True,236600,Kanye West,Lupe Fiasco,2,78,681,"[Chorus: Kanye West]
I gotta testify
Come up in the spot lookin' extra fly
'Fore the day I die, I'ma touch the sky
Gotta testify
Come up in the spot lookin' extra fly
'Fore the day I die, I'ma touch the sky

[Verse 1: Kanye West]
Back when they thought pink Polos would hurt the Roc
Before Cam got the shit to pop
The doors was closed
I felt like Bad Boy's street team: I couldn't work the locks
Now let's go, take 'em back to the plan
Me and my momma hopped in that U-Haul van
Any pessimists, I ain't talk to them
Plus I ain't have no phone in my apart-a-ment
Let's take 'em back to the club
Least about an hour I stand on line
I just wanted to dance, I went to Jacob an hour
After I got my advance, I just wanted to shine
Jay favorite line: ""Dawg, in due time!""
Now he look at me, like, ""Damn, dawg! You where I am!""
A hip-hop legend
I think I died in that accident, ‘cause this must be Heaven

[Chorus: Kanye West]
I gotta testify
Come up in the spot lookin' extra fly
'Fore the day I die, I'ma touch the sky
Gotta testify
Come up in the spot lookin' extra fly
'Fore the day I die, I'ma touch the sky

[Post-Chorus: Kanye West]
Now let's take them hi-ah-igh-igh-igh-ighhhh
(Top of the world, baby, top, top of the world!)
A-la-la-la-lah-la-lahhhhh
(Top of the world, baby, on top of the world!)
Now let's take them hi-ah-igh-igh-igh-ighhhh
(Top of the world, baby, top, top of the world!)
A-la-la-la-lah-la-lahhhhh
(Top of the world, baby, on top of the world!)

[Verse 2: Kanye West]
Back when Gucci was the shit to rock
Back when Slick Rick got the shit to pop
I'd do anything to say I got it
Damn, them new loafers hurt my pocket
Before anybody wanted K. West beats
Me and my girl split the buffet at KFC
Dawg, I was havin' nervous breakdowns
Like ""Man, these niggas that much better than me?""
Baby, I'm goin' on an aeroplane
And I don't know if I'll be back again
Sure enough, I sent the plane tickets
But when she came to kick it, things became different
Any girl I cheated on, sheets I skeeted on
Couldn't keep it at home, thought I needed a Nia Long
I'm tryin' to right my wrongs
But it's funny them same wrongs helped me write this song, now

[Chorus: Kanye West]
I gotta testify
Come up in the spot lookin' extra fly
'Fore the day you die, you gon' touch the sky
You gon' touch the sky, baby girl, testify
Come up in the spot lookin' extra fly
'Fore the day you die, you gon' touch the sky

[Verse 3: Lupe Fiasco]
Yes, yes, yes, guess who's on third?
Lupe steal like Lupin the 3rd
Here like ear 'til I'm beer on the curb
Peachfuzz buzz but beard on the verge
Let's slow it down like we're on the syrup
Bottle-shaped body like Mrs. Butterworth
But before you say another word
I'm back on the block like I'm layin' on the street
I'm tryna stop lyin' like I'm Mumm-Ra
But I'm not lyin' when I'm layin' on the beat, en garde
Or touché, Lupe cool as the unthawed
But I still feel possessed as a gun charge
Come as correct as a porn star
In a fresh pair steps in my best foreign car
So, I represent the first
Now let me end my verse right where the horns are, like uh

[Chorus: Kanye West]
I gotta testify
Come up in the spot lookin' extra fly
'Fore the day you die, you gon' touch the sky
You gon' touch the sky, baby girl, testify
Come up in the spot lookin' extra fly
'Fore the day you die, you gon' touch the sky

[Outro: Kanye West]
We back at home, baby!
Sky high, I’m, I’m sky high!
I’m, I’m sky high!
I’m, I’m sky high!
I’m, I’m sky high!
I’m, I’m sky high!
Sky, sky high! I’m, I’m sky high!
Yeah, keep it rollin'!
Yeah, uh, feels good to be home, baby!
Feels good to be home!

[Produced by Just Blaze]",708,42.0,9.0,True
Yeezus,7D2NdGvBHIavgLhmcwhluK,2013-06-18,4,1,New Slaves,4cAgkb0ifwn0FSHGXnr4F6,True,256093,Kanye West,,1,65,152640,"[Intro: Swizz Beatz]
Chill, chill, chill, chill, chill, chill
Chill, chill, chill, chill, chill, chill
Chill, chill, chill, chill, chill, chill
Chill, chill, chill, chill, chill, chill

[Verse 1: Kanye West]
My mama was raised in the era when
Clean water was only served to the fairer skin
Doin' clothes, you would've thought I had help
But they wasn't satisfied unless I picked the cotton myself
You see, it's broke nigga racism
That's that, ""Don't touch anything in the store""
And it's rich nigga racism
That's that, ""Come in, please buy more""
""What you want, a Bentley? Fur coat? A diamond chain?
All you blacks want all the same things""
Used to only be niggas, now everybody playin'
Spendin' everything on Alexander Wang
New slaves

[Bridge: Kanye West]
You see it's leaders and it's followers
But I'd rather be a dick than a swallower
You see it's leaders and it's followers
But I'd rather be a dick than a swallower

[Verse 2: Kanye West]
I throw these Maybach keys, I wear my heart on the sleeve
I know that we the new slaves, I see the blood on the leaves
I see the blood on the leaves, I see the blood on the leaves
I know that we the new slaves, I see the blood on the leaves
They throwin' hate at me, want me to stay at ease
Fuck you and your corporation, y'all niggas can't control me
I know that we the new slaves, I know that we the new slaves
I'm 'bout to wild the fuck out, I'm goin' Bobby Boucher
I know that pussy ain't free, you niggas pussy, ain't me
Y'all throwin' contracts at me, you know that niggas can't read
Throw on some Maybach keys, fuck it, c'est la vie
I know that we the new slaves, y'all niggas can't fuck with me
Y'all niggas can't fuck with Ye, y'all niggas can't fuck with Ye
I'll move my family out the country, so you can't see where I stay
So go and grab the reporters, so I can smash their recorders
See, they'll confuse us with some bullshit, like the New World Order
Meanwhile the DEA teamed up with the CCA
They tryna lock niggas up, they tryna make new slaves
See, that's that privately owned prison, get your peace today
They prolly all in the Hamptons braggin' 'bout what they made
Fuck you and your Hampton house, I'll fuck your Hampton spouse
Came on her Hampton blouse and in her Hampton mouth
Y'all 'bout to turn shit up, I'm 'bout to tear shit down
I'm 'bout to air shit out, now what the fuck they gon' say now?

[Bridge]
Nothing bad, nothing bad, noth—
Noth-noth— 'ing bad, noth— (Noth-noth—)
Bad, nothing bad, nothing bad
Nothing—

[Outro: Kanye West, Frank Ocean & Kóbor János]
I won't end this fight, not this time again
So long, so long, so long, you cannot survive
And I'm not dyin', and I can't lose
I can't lose, no, I can't lose
'Cause I can't leave it to you
So let's get too high, get too high again
Too high again, too high
Ooh, ooh, ooh, o-ooh, ooh
Woo 
(
Hey
)
Ooh, ooh-ooh, high, hi-high, high
High, high, hi-high (Yeah)
High, high, ah, oh
Egyszer a Nap úgy elfáradt
 (
Ah, ah, ah
)
Elaludt mély zöld tó ölén
Az embereknek fájt a sötét
Ő megsajnált, eljött közénk

[Produced by Che Pope, Sham Joseph, Ben Bronfman, Noah Goldstein, Travis Scott, Mike Dean & Kanye West]",587,56.0,2.0,True
My Beautiful Dark Twisted Fantasy,20r762YmB5HeofjMCiPMLv,2010-11-22,1,1,Dark Fantasy,7yNK27ZTpHew0c55VvIJgm,True,280786,Kanye West,,1,69,1660,"[Produced by Kanye West & RZA]

[Intro: Nicki Minaj]
You might think you've peeped the scene
You haven't, the real one's far too mean
The watered-down one, the one you know
Was made up centuries ago
They made it sound all wack and corny
Yes, it's awful blasted boring
Twisted fictions, sick addiction
Well, gather 'round, children, zip it, listen

[Chorus: Justin Vernon & 
Teyana Taylor
]
Can we get much higher? (
So high
)
Oh, oh, oh
Oh, oh, oh-oh, oh (
Oh
)
Can we get much higher? (
So high
)
Oh, oh, oh
Oh, oh, oh-oh, oh
Can we get much higher? (
So high
)
Oh, oh, oh
Oh, oh, oh-oh, oh (
Oh
)
Can we get much higher? (
So high
)
Oh, oh, oh
Oh, oh, oh-oh, oh

[Verse 1: Kanye West]
Yeah, yeah, yeah, yeah
I fantasized 'bout this back in Chicago
Mercy, mercy me, that Murciélago
That's me the first year that I blow
How you say broke in Spanish? Mi no hablo
Me drown sorrow in that Diablo
Me found bravery in my bravado
DJs need to listen to the models
You ain't got no fuckin' Yeezy in your Serato? (
You ain't got no Yeezy, nigga?
)
Stupid, but what the hell do I know?
I'm just a Chi-Town nigga with a Nas flow
And my chick in that new Phoebe Philo
So much head, I woke up to Sleepy Hollow

[Chorus: Justin Vernon & Teyana Taylor]
Can we get much higher?
Oh, oh, oh
Oh, oh, oh-oh, oh

[Verse 2: Kanye West]
Look like a fat booty Celine Dion
Sex is on fire, I'm the King of Leona Lewis
Beyond the truest
Hey, teacher, teacher, tell me how do you respond to students?
And refresh the page and restart the memory?
Re-spark the soul and rebuild the energy?
We stopped the ignorance, we killed the enemy
Sorry for the night demons that still visit me
The plan was to drink until the pain over
But what's worse, the pain or the hangover?
Fresh air, rollin' down the window
Too many Urkels on your team, that's why your wins low
Don't make me pull the toys out, huh
Don't make me pull the toys
And fire up the engines, huh
And then they make noise

[Chorus: Justin Vernon & 
Teyana Taylor
]
Can we get much higher? (
So high
)
Oh, oh, oh
Oh, oh, oh-oh, oh

[Bridge: Justin Vernon & Kanye West]
At the mall, there was a seance
Just kids, no parents
Then the sky filled with herons
Saw the devil in a Chrysler LeBaron
And the hell, it wouldn't spare us
And the fires did declare us
But after that, took pills, kissed an heiress
And woke up back in Paris

[Chorus: Justin Vernon & Teyana Taylor]
Can we get much higher? (So high)
Oh, oh, oh
Oh, oh, oh-oh, oh, oh

[Chorus: Justin Vernon & 
Teyana Taylor
]
Can we get much higher? (
So high
)
Oh, oh, oh
Oh, oh, oh-oh, oh (
Oh
)
Can we get much higher? (
So high
)
Oh, oh, oh
Oh, oh, oh-oh, oh
Can we get much higher? (
So high
)
Oh, oh, oh
Oh, oh, oh-oh, oh (
Oh
)
Can we get much higher? (
So high
)
Oh, oh, oh
Oh, oh, oh-oh, oh, oh",567,60.0,1.0,True
