Album,Album ID,Release Date,Track Number,Disc Number,Track Name,Track ID,Explicit,Duration,Primary Artist,Featured Artists,Total Artists,Popularity,Genius Track ID,Lyrics,Word Count
The Life Of Pablo,7gsWAHLeT0w7es6FofOXk1,2016-06-10,17,1,No More Parties In LA,0zLClc0emc6qUeV1p5nc99,True,374413,Kanye West,,1,70,2403856,"[Intro: Johnny ""Guitar"" Watson & Junie Morrison]
La-di-da-da-a, da-a (I like this flavor)
La-da-da-da-di-da-da-a, la-a (La-a, la-a, la-a)
Let me tell you, I'm out here
From a very far away place
All for a chance to be a star
Nowhere seems to be too far

[Chorus: Kanye West, Junie Morrison & Ghostface Killah]
No more parties in L.A.
Please, baby, no more parties in L.A., uh
No more parties in L.A.
Please, baby, no more parties in L.A., uh
No more (
Los Angeles
)
Please (
Shake that body, party that bod—
)
Please (
Shake that body, party that bod—
)
Please (
Shake that body, party that body
)

[Verse 1: Kendrick Lamar & Kanye West]
Hey, baby, you forgot your Ray Bans
And my sheets still orange from your spray-tan
It was more than soft porn for the K-Man
She remember my Sprinter, said ""I was in the grape van""
Um—well, cutie, I like your bougie booty
Come, Erykah Badu-me—well, let's make a movie
Hell, you know my repertoire is like a wrestler
I show you the ropes, connect the dotsA country girl in North Hollywood
Mama used to cook red beans and rice
Now it's Denny's, 4 in the morning, spoil your appetite
Liquor pouring and niggas swarming your section with erection
Smoke in every direction, middle finger pedestrians
R&B singers and lesbians, rappers and managers
Music and iPhone cameras
This shit unanimous for you, it's damaging for you, I think
That pussy should only be holding exclusive rights to me, I mean
He flew you in this motherfucker on first class
Even went out his way so you could check in an extra bag
Now you wanna divide the yam like it equate the math?
That shit don't add up, you're making him mad as fuck
She said she came out here to find an A-list rapper
I said, ""Baby, spin that 'round and say the alphabet backwards""
You're dealing with malpractice, don't kill a good nigga's confidence
Just 'cause he a nerd and you don't know what a condom is
The head still good, though; the head still good, though
Make me say ""Nam Myoho Renge Kyo""
Make a nigga say big words and act lyrical
Make me get spiritual, make me believe in miracles
Buddhist monks and Cap'n Crunch cereal
Lord have mercy, thou will not hurt me
Five buddies all herded up on a Thursday
Bottle service, head service, I came in first place
The opportunity, the proper top of breast and booty cheek
The pop community, I mean these bitches come with union fee
And I want two of these, moving units through consumer streets
Then my shoe released, she was kickin' in gratuity
And yeah, G, I was all for it
She said, ""K-Lamar, you kinda dumb to be a poet
I'ma put you on game for the lames that don't know they a rookie
Instagram is the best way to promote some pussy""

[Chorus: Kanye West]
Scary, scary
No more parties in L.A.
Please, baby, no more parties in L.A.

[Verse 2: Kanye West]
Friday night, tryna make it into the city
Breakneck speeds, passenger seat—somethin' pretty
Thinking back to how I got here in the first place
Second-class bitches wouldn't let me on first base
A backpack nigga with luxury tastebuds
And the Louis Vuitton store got all of my pay stubs
Got pussy from beats I did for niggas more famous
When did I become A-list? I wasn't even on a list
Strippers get invited to where they only got hired
When I get on my Steve Jobs, somebody gon' get fired
I was uninspired since Lauryn Hill retired
And 3 Stacks, man, you preaching to the choir
Any rumor you ever heard about me was true and legendary
I done got Lewinsky'd and paid secretaries
For all my niggas with babies by bitches
That use they kids as meal tickets
Not knowin' the disconnect from the father
The next generation will be the real victims
I can't fault 'em, really
I 'member Amber told my boy
No matter what happens, she ain't goin' back to Philly
Back to our regularly scheduled programmin'
Of weak content and slow jammin'
But don't worry, this one's so jammin'
You know it, L.A., it's so jammin'
I be thinkin' every day
Mulholland Drive need to put up some goddamn barricades
I be paranoid every time, the pressure
The problem ain't I be drivin', the problem is I be textin'
My psychiatrist got kids that I inspired
First song they played for me was 'bout their friend that just died
Textin' and drivin' down Mulholland Drive
That's why I'd rather take the 405
I be worried 'bout my daughter, I be worried 'bout Kim
But Saint is baby Ye, I ain't worried 'bout him
Had my life threatened by best friends with selfish intents
What I'm supposed to do?
Ride around with a bulletproof car and some tints?
Every agent I know know I hate agents
I'm too black, I'm too vocal, I'm too flagrant
Something smellin' like shit, that's the new fragrance
It just mean, I do it my way, bitch
Some days I'm in my Yeezys, some days I'm in my Vans
If I knew y'all made plans, I wouldn't have popped the Xans
I know some fans thought I wouldn't rap like this again
But the writer's block is over; emcees, cancel your plans
A thirty-eight-year-old eight-year-old with rich nigga problems
Tell my wife that I hate the Rolls so I don't never drive it
It took six months to get the Maybach all matted out
And my assistant crashed it soon as they backed it out
Goddamn! Got a bald fade, I might slam
Pink fur, got Nori dressin' like Cam
Thank God for me (
Los Angeles
)
Whole family gettin' money, thank God for E
I love rockin' jewelry, a whole neckful
Bitches say he funny and disrespectful
I feel like Pablo when I'm workin' on my shoes
I feel like Pablo when I see me on the news
I feel like Pablo when I'm workin' on my house
Tell 'em party's in here, we don't need to go out
We need the turbo thots, high speed, turbo thots
Drop-dro-dro-dro-drop, like Robocop
She brace herself and hold my stomach, good dick'll do that
She keep pushin' me back, good dick'll do that
She push me back when the dick go too deep
This good dick'll put your ass to sleep
Get money (Money, money, money)
Big, big money (Money, money, money)
And as far as real friends, tell all my cousins I love 'em
Even the one that stole the laptop, you dirty motherfucker

[Bridge: Larry Graham]
I just keep on lovin' you, baby
And there's no one else I know can take your pla—, pla—, pla—

[Chorus: Kanye West, 
Junie Morrison
 & 
Ghostface Killah
]
Please, no more parties in L.A. (
Shake that body, party that body
)
Please, baby, no more parties in L.A., uh (
Shake that body, party that body
)
No more parties in L.A. (
Los Angeles
)
Please, baby, no more parties in L.A., uh
No more parties in L.A.
Please, baby, no more parties in L.A., uh

[Outro: Junie Morrison]
Let me tell you, I'm out here from a very far away place
All for a chance to be a star
Nowhere seems to be too far
Swish

[Produced by Madlib and Kanye West]",1249
The Life Of Pablo,7gsWAHLeT0w7es6FofOXk1,2016-06-10,4,1,Famous,19a3JfW8BQwqHWUMbcqSx8,True,196040,Kanye West,,1,70,2412662,"[Intro: Rihanna & Kanye West]
Man, I can understand how it might be
Kinda hard to love a girl like me
I don't blame you much for wanting to be free
I just wanted you to know
Woo, woo
Swizz told me let the beat rock
 (Oh)
Oh

[Verse 1: Kanye West & Swizz Beatz]
For all my Southside niggas that know me best
I feel like me and Taylor might still have sex
Why? I made that bitch famous (
Goddamn
)
I made that bitch famous
For all the girls that got dick from Kanye West
If you see 'em in the streets, give 'em Kanye's best
Why? They mad they ain't famous (
Goddamn
)
They mad they still nameless (
Talk that talk, man
)
Her man in the store tryna try his best
But he just can't seem to get Kanye fresh
But we still hood famous (
Goddamn
)
Yeah, we still hood famous

[Chorus: Rihanna & Swizz Beatz]
I just wanted you to know
I've loved you better than your own kin did
From the very start
I don't blame you much for wanting to be free
Wake up, Mr. West! Oh, he's up!
I just wanted you to know

[Verse 2: Kanye West & Swizz Beatz]
I be Puerto Rican day parade floatin'
That Benz Marina Del Rey coastin'
She in school to be a real estate agent
Last month, I helped her with the car payment
Young and we alive, 
whoo!
We never gonna die, 
whoo!
I just copped a jet to fly over personal debt
Put one up in the sky
The sun is in my eyes, 
whoo!
Woke up and felt the vibe, 
whoo!
No matter how hard they try, 
whoo!
We never gonna die

[Chorus: Rihanna & 
Swizz Beatz
]
I just wanted you to know
Get 'em!

[Bridge: Sister Nancy & Swizz Beatz]
Bam, 'ey 'ey 'ey
Bam bam, bam, bam bam dilla
Bam bam 'ey 'ey 'ey
What a bam, bam, bam bam dilla
How you feeling right now? Let me see your lighters in the air
Bam bam 'ey 'ey 'ey 'ey 'ey
Bam bam 'ey 'ey 'ey
What a bam
Let me see your middle finger in the air
Bam 'ey 'ey 'ey
Bam bam, bam, bam bam dilla
Let me see you act up in this motherfucker
Bam bam 'ey 'ey 'ey
What a bam, bam, bam bam dilla
How you feelin', how you feelin', how you feelin' in this mother fucker, God damn
Bam bam 'ey 'ey 'ey 'ey 'ey
Bam bam 'ey 'ey 'ey
What a bam
One thing you can't do 
is
 stop us now
Bam 'ey 'ey 'ey
Bam bam bam, bam bam dilla
Ayy, you can't stop the thing now
Bam bam 'ey 'ey 'ey
What a bam, bam, bam bam dilla
Man, it's way too late, it's way too late, it's way too late, you can't fuck with us
Bam bam, 'ey 'ey 'ey 'ey 'ey
Bam bam, 'ey 'ey 'ey
What a bam
To the left, to the right
Bam 'ey 'ey 'ey
Bam bam bam, bam bam dilla
I wanna see everybody hands in the air like this
Bam bam 'ey 'ey 'ey
What a bam, bam, bam bam dilla
Bam bam 'ey 'ey 'ey 'ey 'ey
Bam bam 'ey 'ey 'ey
What a bam, bam

[Outro: Nina Simone]
I just wanted you to know
I loved you better than your own kin did
From the very start
I don't blame you much for wanting to be free
I just wanted you to know

[Produced by Kanye West, Charlie Heat, Havoc & Noah Goldstein]",609
The Life Of Pablo,7gsWAHLeT0w7es6FofOXk1,2016-06-10,20,1,Saint Pablo,1o0kWPueYo94LIjPYOE5Nf,True,372113,Kanye West,,1,70,2428259,"[Intro: Kanye West]
Yeah-yeah, 9:08 L.A. time
Back in the lab and shit

[Verse 1: Kanye West]
My wife said I can't say no to nobody
And at this rate, we gon' both die broke
Got friends that ask me for money knowin' I'm in debt
And like my wife said, I still didn't say no
People tryna say I'm goin' crazy on Twitter
My friends' best advice was to stay low
I guess it's hard to decipher all of the bills
Especially when you got family members on payroll
The media said it was outlandish spendin'
The media said he's way out of control
I just feel like I'm the only one not pretendin'
I'm not out of control, I'm just not in their control
I know I'm the most influential
That 
TIME
 cover was just confirmation
This generation's closest thing to Einstein
So don't worry about me, I'm fine
I can see a thousand years from now in real life
Skate on the paradigm and shift it when I feel like
Troll conventional thought, don't need to question
I know it's antiquated so sometimes I get aggressive
Thank God for Jay Electra, he down with the mission
Did it with no permission, on our own conditions
Most blacks with money have been beaten to submission
Yeezy with the big house, did it way different
Never listen to Hollywood producers
Don't stare at money too long, it's Medusa
The ultimate Gemini has survived
I wasn't supposed to make it past 25

[Chorus: Sampha]
Yeah, you're lookin' at the church in the night sky
Wonderin' whether God's gonna say hi
Oh, you're lookin' at the church in the night sky
And you wonder where is God in your nightlife
Yeah, you're lookin' at the church in the night sky
(Father, Father, Father in the night sky)
Wonderin' whether God's gonna say hi
Yeah, I feel like I'm home, yeah, yeah

[Verse 2: Kanye West]
I've been wakin' the spirits of millions more to come
A million illegally downloaded my truth over the drums
I believe in the children, listen to the kids, bro
If the phone ringin', go and get your kids, ho
Brother Don Muhammad told the minister about the presentation
He sat back and smiled
Black on black lies is worse than black on black crime
The Jews share their truth on how to make a dime
Most black men couldn't balance a checkbook
But buy a new car, talkin' 'bout, ""How my neck look?""
Well, it all looks great
Four hundred years later, we buyin' our own chains
The light is before us brothers, so the devil workin' hard
Real family stick together and see through the mirage
The smokescreens, perceptions of false reality
Who the real owner if your boss gets a salary?
I am one with the people
I am one with the people (
Real!
)
I've been woken from enlightened man's dream
Checkin' Instagram comments to crowdsource my self-esteem
Let me not say too much or do too much
'Cause if I'm up way too much, I'm out of touch
I'm prayin' a out-of-body experience will happen
So the people can see my light, now it's not just rappin'
God, I have humbled myself before the court
Drop my ego when confidence was my last resort
I know, I know He got a plan, I know I'm on Your beams
One set of footsteps, You was carryin' me
When I turned on the news and they was buryin' me
One set of footsteps, You was carryin' me
When I was negotiatin' with Apple, it was Larry and me
Told Tim Cook to call me, I was scary to see
I would've took a hundred million and gave twenty to Hov
I heard it's the way they did it when we only had a stove
But it's better that I stayed at home with my folks
'Cause if Jay a billionaire then I'ma never go broke
Only thing I ask is next time I'm on stage we all go
We all go
Not just by myself, lookin' for niggas like where's Waldo
She got the same shoes as my wife but she copped 'em at Aldo
Modern-day MJ, with a off-the-wall flow

[Bridge: Sampha]
Nightlife, walk all over me
Walk all over me
I'm deliverin' everything I've ever sent that you'll bring
Fly, fly, fly overseas
Fly overseas
Oh, anywhere, everything but in between
Oh, yeah

[Chorus: Sampha]
Yeah, you're lookin' at the church in the night sky
Wonderin' whether God's gonna say hi
Oh, you're lookin' at the church in the night sky
And you wonder where is God in your nightlife
Yeah, you're lookin' at the church in the night sky
Wonderin' whether God's gonna say hi
(Father, Father, Father in the night sky)
Oh, you're lookin' at the church in the night sky
And you wonder where is God in your nightlife
(Father, Father, Father in the night sky)

[Verse 3: Sampha]
Please face me when I speak
Please say to me somethin' before you leave
You've been treatin' me like I'm invisible, now I'm visible to you
Oh, the invisible truth stay sober
I can't quite understand the games you play
Understand, understand, understand I'm standin' under oath
And I promised I, I wouldn't fall anymore
But I'm cryin' at the bar
I'm wishin' that you saw my scars, man
I'm wishin' that you came down here and stood by me
And looked at me like you knew me
But I feel so alone
Like I don't know anyone except the night sky above

[Chorus: Sampha]
Yeah, you're lookin' at the church in the night sky
Wonderin' whether God's gonna say hi
Oh, you're lookin' at the church in the night sky
And you wonder where is God in your nightlife
Yeah, you're lookin' at the church in the night sky
(Father, Father, Father in the night sky)
Wonderin' whether God's gonna say hi
Oh, you're lookin' at the church in the night sky
And you wonder where is God in your nightlife
(Father, Father, Father in the night sky)",1020
The Life Of Pablo,7gsWAHLeT0w7es6FofOXk1,2016-06-10,10,1,Waves,3nAq2hCr1oWsIU54tS98pL,True,181573,Kanye West,,1,69,2412668,"[Intro]
Turn it up!

[Verse 1: Kanye West]
Step up in this bitch like (
Turn it up!)
I'm the one your bitch like
Yeah, I'm the one your bitch like (
Turn it up!
)
And I be talkin' shit like
I ain't scared to lose a fistfight (
Turn it up!
)
And she grabbin' on my, like
She wanna see if it'll fit right
That's just the wave (
Turn it up!
)

[Chorus: Chris Brown, Theophilus London]
(
Yeah
) Waves don't die (
Real ting badmon!
)
Let me crash here for the moment (Yeah)
I don't need to own it
No lie
Waves don't die, baby
Let me crash here for a moment (
Yeah, yeah, yeah, yeah
)
Baby, I don't, I don't need to own you (
Turn it up!
)

[Verse 2: Kanye West]
Sun don't shine in the shade, ugh (
Turn it up!
)
Bird can't fly in a cage, ugh (
Turn it up!
)
Even when somebody go away, ugh (
Turn it up!
)
The feelings don't really go away
That's just the wave

[Chorus: Chris Brown, Theophilus London]
(
Yeah
) Waves don't die (
Real ting badmon!
)
Let me crash here for the moment
I don't need to own it
No lie
Waves don't die, baby
Let me crash here for a moment (
Yeah, yeah, yeah, yeah
)
Baby, I don't, I don't need to own you

[Refrain: Chris Brown]
No lie
No lie
No lie
You set the night on fire
I'm still gon' be here in the morning
No lie

[Bridge: Kid Cudi & Kanye West]
(Humming)
[Refrain: Chris Brown]
No lie (Yeah)
Ooh, babe, ooh, baby, oh, yeah
You set the night on fire
I'm still gon' be here in the morning
No lie",305
My Beautiful Dark Twisted Fantasy,20r762YmB5HeofjMCiPMLv,2010-11-22,1,1,Dark Fantasy,7yNK27ZTpHew0c55VvIJgm,True,280786,Kanye West,,1,69,1660,"[Produced by Kanye West & RZA]

[Intro: Nicki Minaj]
You might think you've peeped the scene
You haven't, the real one's far too mean
The watered-down one, the one you know
Was made up centuries ago
They made it sound all wack and corny
Yes, it's awful blasted boring
Twisted fictions, sick addiction
Well, gather 'round, children, zip it, listen

[Chorus: Justin Vernon & 
Teyana Taylor
]
Can we get much higher? (
So high
)
Oh, oh, oh
Oh, oh, oh-oh, oh (
Oh
)
Can we get much higher? (
So high
)
Oh, oh, oh
Oh, oh, oh-oh, oh
Can we get much higher? (
So high
)
Oh, oh, oh
Oh, oh, oh-oh, oh (
Oh
)
Can we get much higher? (
So high
)
Oh, oh, oh
Oh, oh, oh-oh, oh

[Verse 1: Kanye West]
Yeah, yeah, yeah, yeah
I fantasized 'bout this back in Chicago
Mercy, mercy me, that Murciélago
That's me the first year that I blow
How you say broke in Spanish? Mi no hablo
Me drown sorrow in that Diablo
Me found bravery in my bravado
DJs need to listen to the models
You ain't got no fuckin' Yeezy in your Serato? (
You ain't got no Yeezy, nigga?
)
Stupid, but what the hell do I know?
I'm just a Chi-Town nigga with a Nas flow
And my chick in that new Phoebe Philo
So much head, I woke up to Sleepy Hollow

[Chorus: Justin Vernon & Teyana Taylor]
Can we get much higher?
Oh, oh, oh
Oh, oh, oh-oh, oh

[Verse 2: Kanye West]
Look like a fat booty Celine Dion
Sex is on fire, I'm the King of Leona Lewis
Beyond the truest
Hey, teacher, teacher, tell me how do you respond to students?
And refresh the page and restart the memory?
Re-spark the soul and rebuild the energy?
We stopped the ignorance, we killed the enemy
Sorry for the night demons that still visit me
The plan was to drink until the pain over
But what's worse, the pain or the hangover?
Fresh air, rollin' down the window
Too many Urkels on your team, that's why your wins low
Don't make me pull the toys out, huh
Don't make me pull the toys
And fire up the engines, huh
And then they make noise

[Chorus: Justin Vernon & 
Teyana Taylor
]
Can we get much higher? (
So high
)
Oh, oh, oh
Oh, oh, oh-oh, oh

[Bridge: Justin Vernon & Kanye West]
At the mall, there was a seance
Just kids, no parents
Then the sky filled with herons
Saw the devil in a Chrysler LeBaron
And the hell, it wouldn't spare us
And the fires did declare us
But after that, took pills, kissed an heiress
And woke up back in Paris

[Chorus: Justin Vernon & Teyana Taylor]
Can we get much higher? (So high)
Oh, oh, oh
Oh, oh, oh-oh, oh, oh

[Chorus: Justin Vernon & 
Teyana Taylor
]
Can we get much higher? (
So high
)
Oh, oh, oh
Oh, oh, oh-oh, oh (
Oh
)
Can we get much higher? (
So high
)
Oh, oh, oh
Oh, oh, oh-oh, oh
Can we get much higher? (
So high
)
Oh, oh, oh
Oh, oh, oh-oh, oh (
Oh
)
Can we get much higher? (
So high
)
Oh, oh, oh
Oh, oh, oh-oh, oh, oh",567
The College Dropout,4Uv86qWpGTxf7fU7lG5X6F,2004-02-10,20,1,Family Business,5DBmXF7QO43Cuy9yqva116,True,278893,Kanye West,,1,68,1761,"[Intro]
How's your son?
(
All, all, all tha-thang, thang, all, all tha-thang, thang, thang
)
He made the team this year?
Aight, they said he wasn't tall enough
(
All, all that glitters is not gold, all gold is not reality, real is what you lays on me
)
Ma', we here, we gon' cook this Sunday, okay? So come by
Damn, that's your new girlfriend?

[Verse 1]
This is family business
And this is for the family that can't be with us
And this is for my cousin locked down, know the answer's in us
This why I spit it in my songs so sweet, like a photo of your granny's picture
Now that you're gone, it hit us
Super hard on Thanksgiving and Christmas, this can't be right
Yo, you heard the track I did, man? ""This Can't Be Life""
Somebody please say grace, so I can save face
And have a reason to cover my face
I even made you a plate, soul food, know how Granny do it
Monkey bread on the side, know how the family do it
When I brought it, why the guard had to look all through it?
As kids, we used to laugh, who knew that life would move this fast?
Who knew I'd have to look at you through a glass?
And look, you tell me you ain't did it, then you ain't did it
And if you did, then that's family business

[Chorus]
And I don't care about (All, all, diamond ring, diamond ring)
They don't mean a thing
(All, all, all, tha-thang, thang, all, all tha-thang, thang, thang)All these fancy things
I tell you that all is my weight in gold
(All, all that glitters is not gold, all gold is not reality, real is what you lays on me)
Now, all I know, I know all these things

[Verse 2]
Yeah, this is family business
And this is for everybody standing with us
Come on, let's take a family Grammy picture
Abi, remember when they ain't believe in me?
Now she like, ""See! That's my cousin on TV!""
Now, we gettin' it and we gon' make it
And they gon' hate it, and I'm his favorite
I can't deny it, I'm a straight rider
But when we get together, be Electric Slidin'
Grandma, get 'em shook up
Aw, naw, don't open the photobook up
I got a Aunt Ruth that can't remember your name
But I bet them Polaroids'll send her down memory lane
You know that one auntie, you don't mean to be rude
But every holiday, nobody eating her food
And you don't wanna stay there 'cause them your worst cousins
Got roaches at they crib like them your first cousins
Act like you ain't took a bath with your cousin
Fit three in the bed if it's six of y'all
I'm talkin' 'bout three by the head and three by the leg
But you ain't have to tell my girl I used to pee in the bed

[Bridge]
Rain, rain, rain, go away
Let the sun come out and all the children say
 (Uh)
Rain, rain, rain, go away
 (Yeah)
Let the sun come out and all the children say
 (Yeah, yeah, yeah)

[Verse 3]
I woke up early this morning with a new state of mind
A creative way to rhyme without using nines and guns
Keep your nose out the sky, keep your heart to God
And keep your face to the risin' sun
All my niggas from the Chi' is my family, dawg
And my niggas ain't my guys, they my family, dawg
I feel like, one day, you'll understand me, dawg
You can still love your man and be manly, dawg
You ain't gotta get heated at every housewarmin'
Sittin' here, grillin' people like George Foreman
Why Uncle Ray and Aunt Sheila always performin'?
Second she storm out, then he storm in
Y'all gon' sit down, have a good time this reunion
And drink some wine like Communion
And act like everything fine and if it isn't
We ain't letting everybody in our family business, uh

[Bridge]
(All, all, diamond ring, diamond ring)
They don't mean a thing
(All, all, all tha-thang, thang, all, all tha-thang, thang, thang)
They don't mean a thing
(
All, all that glitters is not gold, all gold is not reality, real is what you lays on me
)
They don't mean a thing, a thing

[Chorus]
And I don't care about (Woo! All, all, diamond ring, diamond ring)
They don't mean a thing (All, all, all tha-thang, thang, all, all tha-thang, thang, thang)
All these fancy things
I tell you that all is my weight in gold (
All, all that glitters is not gold, all gold is not reality, real is what you lays on me
)
And all I know, I know all these things

[Outro]
All these things
CLK Mercedes 
Benz
All these things
A whole lotta money
All these things
Mommy and Daddy, can you please stop fighting?
All these things (And I don't care about)
All these things
Let's get Stevie out of jail",856
